Alertness|What could happen if you hang objects from your rear-view mirror?|Your windscreen might fog up|You could be distracted or have your view blocked|Your mirror might fall off|Your radio might not work|2|rearviewmirror|Anything dangling from your rear view mirror or stuck to your windscreen could distract you from driving properly. Make sure you can see through your windscreen clearly.
Alertness|Why should you use your mirrors after you've spotted a hazard up ahead?|To see what's ahead of you|To check to see if you can do an emergency stop|To check whether you can accelerate|To assess the situation around you and react accordingly|4|hazard|You should be checking your mirrors regularly, ensuring you always know what's ahead, beside, and behind you. Doing this will help you anticipate what might happen next, helping avoid and prevent hazards. It's especially important to check your mirrors when you spot a hazard.
Alertness|In which of the following situations would windscreen pillars hinder your view of the road?|On a dual carriageway|On a one-way street|Approaching bends or junctions|On a motorway|3|pillar|Smaller vehicles and road users - pedestrians, motorcyclists, and cyclists - can be hidden by your windscreen pillars. Be sure to move your head to look past them to check the road at bends and junctions.
Alertness|In which of the following situations should you NOT overtake?|On a dual carriageway|When approaching a dip in the road|On a 40 mph road|In a one-way street|2|overtake|Prior to overtaking, consider if it’s really needed. If you can’t see far enough, keep back and wait for a better place to pull out.
Alertness|You intend to turn right at a junction but your view is blocked by parked vehicles. What should you do?|Reverse away from the junction and find another route|Move forward quickly to get a clear view|Get out and have a look at what's approaching|Stop at the junction, then edge forward until you have a clear view|4|parkedvehicles|Buildings, parked cars, and trees often restrict visibility at junctions. To ensure emerging is safe, edge forward slowly to look past obstructions. Ensure you don't cause other drivers to change speed when you pull out.
Attitude|Diamond-shaped traffic signs apply to which type of driver?|Tram drivers|Bus drivers|Drivers of mobility scooters|Motorcyclists|1|diamond_sign|Diamond-shaped traffic signs are specific to tram drivers. However, drivers of other vehicles should know what they mean so they're aware of what the tram driver may do and what their priorities are.
Attitude|Which of the following types of road users do tram rails put most at risk?|HGV drivers|Cyclists|Car drivers|Bus drivers|2|tram_rails|Tram rails are more slippery than tarmac, and could potentially cause cyclists to lose their balance or fall. Additionally, narrow bicycle wheels can get stuck in tram rails, causing them to wobble, stop, or lose their balance.
Attitude|You want to turn right in a one-way street that has two lanes. Which lane should you use?|The right-hand lane|You can't turn right in a one-way street|The left-hand lane|Either lane|1|sign_oneway|When turning right on a one-way street, you should position yourself in the right-hand lane. This way, anyone not turning can pass on your left. Ensure you indicate in good time, and switch lanes early to let everyone know your intentions.
Attitude|When driving at night towards oncoming traffic, which lights should you use on a national speed limit road?|Dipped headlights|Fog lights|Full-beam headlights|Sidelights only|1|headlights|Full-beam headlights can dazzle other drivers. Only use them when you're sure other road users won't be dazzled.
Attitude|What should you do when following another vehicle at night on an unlit road?|Turn off your lights|Use dipped headlights|Flash your headlights periodically|Turn on your full-beam headlights|2|headlights|The drivers of vehicles ahead could be dazzled if you drive behind them with your full-beam headlights on. Ensure your lights are dipped when following other vehicles at night, and leave an amount of space appropriate for the conditions
Attitude|You're being followed closely by a driver who is trying to overtake you. How should you react?|Accelerate to get away from them|Move towards the car in front, giving the overtaking driver nowhere to go|Wave at the overtaking driver to give them permission to pass|Maintain your course and speed, allowing them to overtake|4|overtaking_car|Responding incorrectly to impatient drivers can cause hazards and collisions. You should maintain your course and allow the driver behind to overtake. Slow down if necessary.
Attitude|Why is a loose filler cap on your fuel tank dangerous?|It could leak fuel, making the road slippery|The engine might not start|Your vehicle's exhaust emissions will increase|Your vehicle will be less efficient|1|fuelcap|An improperly secured filler cap can cause fuel to spill, usually at junctions, roundabouts, and on bends. Spilled fuel makes the road surface slippery. This is especially true during long periods of dry weather, when there's been no rain to wash away previous spills.
Attitude|Why shouldn't you follow this vehicle too closely?|You will use more fuel|Your windscreen might fog up|Your view ahead will be reduced, and the lorry driver won't see you|You will be distracted by words on the rear doors|3|hgv|Maintaining your distance will give you a better view of the road ahead. This will allow you to see any potential hazards and give you more time to respond.
Attitude|An LGV (Large Goods Vehicle) carrying a heavy load intends to overtake you, but is taking a long time to do so. How should you react?|Maintain your speed|Slow down to let them pass|Exit at the next junction|Speed up to get ahead|2|hgv|A long lorry carrying a heavy load will take longer to pass you than a car, particularly if the road is uphill. Enable the lorry to pass by slowing down.
Attitude|Why shouldn't you gesture people to cross, by waving or otherwise, at pedestrian crossings?|Another vehicle may be endangering them|They might think you're making a rude gesture|It will increase your journey time|They may not all be ready to cross|1|default|Reduce your speed and get ready to stop if you see people waiting at a pedestrian crossing. Don't prompt them to cross the road by gesturing to them. This could be potentially dangerous as other drivers may not be able to stop in time if they fail to see the pedestrians.
Attitude|Which driving style increases risk for all road users?|Competitive|Defensive|Responsible|Considerate|1|default|Questioning the actions of other road users is defensive driving, and can help you predict possible hazards and react accordingly. The opposite driving style is competitive driving. This increases the risk of collision for all other nearby road users.
Attitude|You are in slow-moving traffic. What action should you take if the driver behind you is too close?|Slow down further|Ignore them and continue as you were|Move towards the centre of the road to prevent them passing|Indicate left and wave for them to pass you|1|traffic|Drivers following too closely increases the risk of collision, as there's less time for them to brake if you suddenly need to stop. The best thing to do is slow down, increasing the gap in front of you. Doing this lessens the odds that you'll have to stop suddenly, giving you more space to brake in case of a hazard. This is an example of defensive driving.
Attitude|What is 'tailgating'?|Keeping rear fog lights on even in broad daylight|Reverse parking|Opening the boot or rear door of a car|Driving too closely behind another vehicle|4|default|When a driver or rider follows the vehicle in front of them too closely, it is referred to as 'tailgating.' It's unsafe because it limits their view of the road ahead. It leaves no room for error if the vehicle in front of them unexpectedly slows down or stops. Tailgating is often the primary cause of rear-end accidents and pile-ups.
Attitude|How should you deal with an unmarked junction?|Stop the car, get out and have a look|Accelerate quickly through the junction|Accelerate, looking left and right quickly|Slow down or stop, then look both ways|4|unmarked_junction|You should be cautious at unmarked junctions, especially where obstructions - such as hedges, parked cars, and buildings - block your view. In summer months, foliage may have grown to obstruct your view further, so take extra care.
Attitude|You're driving behind a vehicle on a wet road. What time gap should you leave between your vehicle and the one you're following?|One second|Two seconds|Three seconds|Four seconds|4|wetroad|The grip of your tyres on the road will be reduced by water. In rainy weather, the two-second safe separation gap should be increased to four seconds.
Attitude|When should you use the 'two-second' rule in dry, good conditions?|When ensuring there is enough distance between you and the car in front|When approaching traffic lights on green|When switching lanes|When your vehicle has stalled|1|default|The 'two-second rule' can be used to judge the distance between you and the vehicle in front in good conditions. Look ahead for a fixed object - road markings or signs, for example - and begin saying this phrase when the vehicle ahead passes it: 'Only a fool breaks the two-second rule.' This phrase takes two seconds to say, so if you're unable to finish it before passing the object, you're too close.
Attitude|What does it mean if a bus lane shows no times of operation?|It is only in use during daylight|It is only in use at peak times|It is a 24-hour bus lane|It is not in use|3|buslane|The times of operation of a bus lane and the types of vehicles allowed to use it are shown on bus-lane signs. If a sign shows no hours of operation, it is a 24-hour bus lane.
Attitude|Which of these vehicles may use flashing blue lights?|A motorway maintenance vehicle|A breakdown recovery vehicle|A snow plough|A bomb disposal vehicle|4|blue_lights|Blue flashing lights are used by emergency vehicles to provide additional warning of a hazard. If you see or hear one approaching, move out of its way, providing it's safe and legal to do so.
Attitude|What should you do if you see a flashing amber light at a pelican crossing?|Give way to pedestrians waiting to cross|Give way to pedestrians already crossing the road|Stop and wait for the green light|Accelerate|2|pelican_crossing|Pelican crossings are pedestrian-operated signalised crossings. The signals are changed using push-button controls. There is no red-and-amber stage preceding green at pelican crossings. Instead, there is a flashing amber light. This means you must yield to pedestrians who are already crossing the street. However, if the crossing is clear, you can proceed.
Attitude|A vehicle behind you accelerates and flashes its lights at you. You are already driving at the legal speed limit. What should you do?|Maintain your speed and move out to stop them overtaking|Go faster|Let the vehicle overtake|Tap the brakes to let them know they're too close|3|headlights|Blocking another vehicle's progress to enforce a speed limit will only frustrate the driver behind, potentially making the situation more dangerous. You should allow the vehicle to pass when it's safe to do so.
Attitude|You see flashing blue lights on an ambulance behind you. How should you react?|Stop in the road|Pull over when it is safe to do so|Accelerate to speed up the flow of traffic|Maintain a steady speed|2|blue_lights|Pull over to the side of the road so that the ambulance can safely pass. Make sure there aren't any bollards or other hazards in the road that would hinder the ambulance’s progress.
Attitude|Which colour follows green at a puffin crossing?|Flashing amber|Steady red|Flashing green|Steady amber|4|greenlights|Infra-red sensors at Puffin crossings detect when pedestrians are still crossing, and keep the red light showing until they've crossed. There is no flashing amber phase at puffin crossings, setting them apart from pelican crossings.
Attitude|What can you do to avoid dazzling drivers behind you at night, while waiting in traffic?|Use the clutch and accelerator to maintain your position|Use the parking brake and footbrake|Press hard on the footbrake|Apply the parking brake and release the footbrake|4|headlights|When possible, you should apply your handbrake while queuing in traffic. Keeping your footbrake depressed can cause your brake lights to dazzle drivers behind.
Attitude|How can you prevent spillage after refuelling your vehicle?|Avoid fully filling your fuel tank|Tap your fuel gauge to ensure it's working|Use only a locking filler cap|Ensure the filler cap is tightly fastened|4|default|Practising filling your fuel tank is a good thing to do while learning to drive. If your instructor does not offer to help you do this, ask them. Learn how to spot the filler cap on your car, how to pull up at the pump, and take care not to overfill your tank to avoid spilling any excess fuel onto the road.
Attitude|What should you do if a vehicle pulls out in front of you at a junction?|Slow down and be prepared to stop|Move up close to it and flash your lights|Swerve and continue past it|Accelerate past it and sound your horn|1|default|Planning ahead and anticipating hazards makes you better prepared for the unexpected. Knowing what's around you helps you predict problems that might arise. Other drivers will inevitably make mistakes. Keep calm and react in the safest way possible.
Attitude|You intend to turn right further down the road. Why should you move into position well in advance to perform this manoeuvre?|So that other drivers have time to plan accordingly|To get a better view of the road|To let other drivers undertake you if they want|To allow drivers to overtake you|1|default|You should indicate and move into position for the turn early. The correct position is nearer the centre of the road, allowing vehicles not turning to pass on your left. Giving nearby drivers early warning of your intentions helps prevent hazards.
Attitude|You need to overtake a horse and rider. What should you do?|Pass slowly and carefully, ensuring the horse doesn't get startled|Pass quickly|Sound your horn to let them know you're there|Flash your lights|1|horse|Passing too closely, too loudly, or too quickly can cause horses to startle or panic. Give them plenty of room as you pass, keeping your speed and engine revs low. You may need to go onto the other side of the road to pass safely.
Attitude|In what situation should you use your horn?|To alert others of your presence|To get the attention of road users you recognise|To let other drivers know they've annoyed you|To make other road users stop|1|horn|Unless a moving vehicle presents a danger, your horn should not be used between 11:30pm and 7am in built up areas or while stationary. The purpose of the horn is to let other road users know you're there.
Attitude|Which of the following is a valid reason for flashing your headlights at other drivers?|To let them know you're there|To show you're about to turn|To let them know you're giving way to them|To tell them you are about to pull out|1|headlights|Your headlights should only be flashed to warn other drivers that you're there. They should not be used in frustration, to give others priority, or to greet people. This could cause a misunderstanding, increasing risk of a collision.
Attitude|What should you do if the red car cuts in front of you?|Sound your horn to show your annoyance|Tailgate the car|Slow down to leave an appropriate distance between you and the car|Flash your headlights|3|redcar|It is inevitable that other drivers will make bad decisions and mistakes. Keep calm and don't retaliate or driver aggressively. The safety of you, your passengers, and other road users should always come fire.
Documents|What qualifications are needed to supervise a learner driver?|The supervisor must be 21 or older, and have held a full driving licence for one year or more|The supervisor must be an approved driving instructor|The supervisor must be 21 or older, and must have held a full driving licence for three years or more|The supervisor must hold an advanced driving certificate|3|default|To supervise a learner driver, you need to be at least 21 years old and have held a full driving licence for a minimum of three years.
Documents|Which of these types of cover must your insurance include to allow you to drive on public roads?|Comprehensive cover|Third party, fire, and theft cover|Personal injury cover|Third party cover|4|default|Third-party insurance is the minimum insurance cover required by law. In the event of an incident, this only covers damage to other vehicles and injury to other people, not damage or injury to you and your vehicle. Fire damage and theft are also not covered. Speak to your insurance company about your requirements to determine which type of insurance is best for your needs.
Documents|What is the purpose of the Pass Plus scheme?|To reduce your MOT costs|To teach you how a vehicle's engine works|To improve a driver's fundamental skills|To allow you to drive without insurance|3|default|The Pass Plus scheme is designed to enhance the skills of new drivers. It teaches motorway driving and night-time driving, widening your experience. Completing a Pass Plus scheme can result in lower insurance costs.
Documents|What is a cover note?|The document issued when delivering your car for its MOT|The document issued before you receive your driving licence|The document issued upon purchasing a new car|The document issued ahead of receiving your official insurance certificate|4|default|An insurance cover note can be issued by an insurance company. It provides the same amount of cover as a full insurance policy, but lasts only for a short time (usually one month).
Documents|A vehicle registration certificate (V5C) is issued when a car is sold or transferred. Who is legally responsible for updating registration information?|The DVLA|The vehicle's registered keeper|The driver's insurance company|The vehicle's manufacturer|2|default|Keeping the details on your vehicle registration certificate (V5C) up to date is your responsibility, and you need to inform the DVLA of any changes. Failing to do this might make selling your vehicle difficult. Details on the V5C include your name, address, and vehicle details.
Documents|Under which of these circumstances must you contact the vehicle licensing authority?|When changing vehicle|When taking your vehicle abroad|When using your vehicle to commute|When renewing your insurance|1|default|You must contact the vehicle licensing authority when you sell your vehicle, and if details such as your name or address change. The helps the DVLA keep up-to-date records of vehicle ownership, and allows them to send road tax reminders when renewal is due. The DVLA keeps a history of every vehicle in the country.
Documents|What is covered by third-party insurance?|Damage to your vehicle|Flood damage to your vehicle|Damage to other vehicles|Fire damage to your vehicle|3|default|Third party insurance only covers damage to other vehicles. Damage to your vehicle and personal injury are not covered, so, in the event of a collision, you may have to pay for repairs on your own vehicle.
Documents|Which of these is a legal requirement for recently qualified drivers?|Being accompanied by an experienced driver on the motorway|Current motor insurance|Green P plates|A Pass Plus course|2|default|Whether you are a new driver or an experienced one, it is your responsibility to make sure you're insured on any vehicle you drive, no one else's.
Documents|Under normal circumstances, how long does a valid MOT certificate last?|For up to 10,000 miles|For up to 30,000 miles|Three years from the date of issue|One year from the date of issue|4|default|MOT test certificates stay valid for 12 months. As it's not feasible to guarantee a test on the same date 12 months later, an MOT test can be taken 1 month before the current certificate expires. The new certificate then lasts 12 months from the date of expiry of the old certificate. Some but not all garages will send reminders to tell you of upcoming MOT tests. Ensure to book your vehicle in promptly
Documents|What does the Pass Plus scheme do for new drivers?|Familiarises them with driving in different conditions|Reduces their car tax|Reduce the cost of breakdown cover|Increases their insurance premiums|1|default|The Pass Plus scheme is designed to enhance the skills of new drivers. It teaches motorway driving and night-time driving, widening your experience. The Pass Plus scheme (and other advanced driving qualifications) must be completed with an approved driving instructor. Completing a Pass Plus scheme can result in lower insurance costs.
Documents|How long does a Statutory Off-Road Notification (SORN) stay valid?|For one year|Until the MOT expires|Until the vehicle's next service|Indefinitely, until the vehicle is taxed, sold, or scrapped|4|default|A Statutory Off-Road Notification (SORN) lasts until your vehicle is taxed, sold, or scrapped. While off-road, it does not need to be taxed.
Documents|As a learner driver, what must you do before driving on a road for the first time?|Sign your provisional licence|Sign up with a driving instructor|Book your practical driving test|Pass your theory test|1|default|Learner drivers need to have a signed provisional licence. The license is not considered valid until signed, so this is something you'll need to do before driving for the first time.
Documents|When might the cost of your insurance premiums be reduced?|If you're under 25 years of age|After passing your driving test|Upon successful completion of a Pass Plus course|If you have 20/20 vision|3|default|Young or inexperienced drivers tend to have more expensive insurance The cost then comes down as you get older and have more experience. Pass Plus is an additional driving qualification for new drivers. It improves your driving skills, and can reduce premiums with some insurers.
Documents|If a police officer asks to see your documents but you don't have them with you, how long do you have to present them at a police station?|14 days|5 days|1 month|7 days|4|default|If a police officer asks to see your documents (insurance information, driving license, etc.) but you don't have them with you, you may be asked to show them at a police station within seven days of being stopped.
Documents|What's the maximum fine for driving without insurance?|Unlimited|£5,000|£1,000|£500|1|default|As well as receiving an unlimited fine, you may be disqualified from driving or incur penalty points for driving uninsured.
Documents|When is it legal to drive without an MOT certificate?|When the owner gives you permission|When driving to an MOT appointment|For seven days following expiry of the previous certificate|When driving at under 30 mph|2|default|A car is first required to pass an MOT test at three years old (four years old in Northern Ireland). The only time it is permitted to drive a car older than three (or four) years without a valid MOT certificate is when driving to an MOT test, or for repairs ahead of an MOT test. Some vehicles made before 1960 may also be driven without an MOT test, but must be considered in roadworthy condition
Documents|Which of the following information is shown on a vehicle registration document (V5C)?|The last MOT date|Details of the vehicle's registered keeper|The vehicle's service history|Details of the type of insurance cover the vehicle has|2|default|Every vehicle's registration document (V5C) shows details of its registration number, date of first registration, make, colour, engine size, year of manufacture, and chassis number. Also included are details of the current and previous registered keepers.
Documents|What is a Statutory Off-Road Notification (SORN)?|An official notice to the DVSA informing them of the vehicles MOT status|An official notice informing the DVLA that the vehicle will not be used on the road|An official document kept by the police about any traffic violations linked to the vehicle|An official document containing all your insurance information|2|default|You must make a Statutory Off-Road Notification (SORN) if you wish to keep your vehicle off-road and untaxed. This stays valid indefinitely, until you tax, sell, or scrap your vehicle.
Documents|When are you required to show your insurance certificate?|When asked for it by a police officer|When selling a vehicle|When submitting a Statutory Off-Road Notice (SORN)|Before an MOT|1|default|When asked to by police, you must be able to provide a valid insurance certificate. If you don't have this with you, you can present it to a police station at a later date. Your MOT certificate and drivers licence may also be asked for.
Documents|Who is required to pay vehicle excise duty (road tax)?|The DVLA|The vehicle's original seller|The driver of the vehicle|The registered keeper of the vehicle|4|default|It is the responsibility of the registered keeper of a vehicle to pay vehicle tax, or to make a Statutory Off-Road Notification (SORN) if keeping the vehicle off the road and untaxed.
Documents|Which of these is a legal requirement for driving another person's vehicle?|The vehicle must have third-party insurance cover|The vehicle must be insured for your use|Your own vehicle must have insurance|Any insurance documents must be inside the vehicle|2|default|You need to make sure that you are properly insured on any vehicle you drive, even if it's not your own. Driving without insurance is illegal. It's good practice to compare several insurance quotes, comparing their features against your needs, before deciding which one is right for you.
